<?xml version="1.0" encoding="UTF-8"?>
<specification xmlns:xsi="http://www.w3.org/2001/XMLSchema-instance"
               xmlns="https://magento.com/open-specification"
               xsi:schemaLocation="https://magento.com/open-specification ../specification.xsd">

    <module name="magento.logistics">
        <service name="carrier_management">
            <summary>Carrier Management</summary>

            <query name="request_shipping_details">
                <summary>Request shipping details</summary>
                <description>
                    This message is used to request shipping label and tracking details per order and box
                </description>
                <extensible>false</extensible>
                <status>public</status>
                <arguments>
                    <argument name="shipment">
                        <summary>Shipment</summary>
                        <type>magento.logistics.customer_shipment</type>
                        <required>true</required>
                    </argument>
                </arguments>
                <returns>array[magento.logistics.package]</returns>
            </query>
        </service>
    </module>

</specification>
