<?xml version="1.0" encoding="UTF-8"?>
<specification xmlns:xsi="http://www.w3.org/2001/XMLSchema-instance"
               xmlns="https://magento.com/open-specification"
               xsi:schemaLocation="https://magento.com/open-specification ../specification.xsd">

    <module name="magento.postsales">

        <service name="return_repository">
            <summary>Return Repository</summary>
            <query name="search">
                <summary>Search returns by criteria</summary>
                <extensible>false</extensible>
                <status>public</status>
                <arguments>
                    <argument name="query">
                        <summary>Query</summary>
                        <type>magento.common.query</type>
                        <required>false</required>
                    </argument>
                </arguments>
                <returns>magento.postsales.return_update_collection</returns>
                <searchable_fields>
                    <field name="source_id">
                        <summary>Source ID</summary>
                    </field>
                    <field name="sales_channel">
                        <summary>Sales channel</summary>
                    </field>
                    <field name="rma">
                        <summary>RMA</summary>
                    </field>
                    <field name="sku">
                        <summary>SKU</summary>
                    </field>
                    <field name="status">
                        <summary>Status</summary>
                    </field>
                    <field name="order_id">
                        <summary>Order ID</summary>
                    </field>
                    <field name="status_date">
                        <summary>Status Date</summary>
                    </field>
                    <field name="origin_date">
                        <summary>Origin Date</summary>
                    </field>
                </searchable_fields>
            </query>
        </service>

        <struct name="return_update_collection">
            <summary>Return Update Collection</summary>
            <extensible>false</extensible>
            <properties>
                <property name="offset">
                    <summary>Search result offset</summary>
                    <type>integer</type>
                    <required>false</required>
                </property>
                <property name="size">
                    <summary>Max number of entries</summary>
                    <type>integer</type>
                    <required>false</required>
                </property>
                <property name="total">
                    <summary>Total number of records matching search query</summary>
                    <type>integer</type>
                    <required>false</required>
                </property>
                <property name="items">
                    <summary>Matching return updates</summary>
                    <type>array[magento.postsales.return_update]</type>
                    <required>false</required>
                </property>
            </properties>
        </struct>

    </module>

</specification>
