<?xml version="1.0" encoding="UTF-8"?>
<specification xmlns:xsi="http://www.w3.org/2001/XMLSchema-instance"
               xmlns="https://magento.com/open-specification"
               xsi:schemaLocation="https://magento.com/open-specification ../specification.xsd">

    <module name="magento.postsales">
        <struct name="shipping_address">
            <summary>Shipping address information</summary>
            <extensible>true</extensible>
            <properties>
                <property name="first_name">
                    <summary>First Name</summary>
                    <type>string</type>
                    <required>true</required>
                </property>
                <property name="last_name">
                    <summary>Last Name</summary>
                    <type>string</type>
                    <required>true</required>
                </property>
                <property name="company_name">
                    <summary>Company name</summary>
                    <type>string</type>
                    <required>false</required>
                </property>
                <property name="address1">
                    <summary>First line of address description</summary>
                    <type>string</type>
                    <required>true</required>
                </property>
                <property name="address2">
                    <summary>Second line of address description</summary>
                    <type>string</type>
                    <required>false</required>
                </property>
                <property name="city">
                    <summary>City of the address</summary>
                    <type>string</type>
                    <required>true</required>
                </property>
                <property name="zip">
                    <summary>Zip code of the address</summary>
                    <type>string</type>
                    <required>true</required>
                </property>
                <property name="state">
                    <summary>State of the address</summary>
                    <type>string</type>
                    <required>true</required>
                </property>
            </properties>
        </struct>
    </module>
</specification>
